{
  "contract_id": "sklegal-v2-mvp-joined-contract",
  "contract_version": "1.0.0",
  "status": "frozen_for_independent_review",
  "base_commit": "8177c88c5fd371a487e2c206c53b24e3619c1855",
  "base_tree": "a23e08dc6edfde8397298b3d1ee0b354434c3bcd",
  "card_id": "cb60092e",
  "source_paths": {
    "react": "apps/web/src/pages/MatterCockpit.tsx",
    "wireframe": "docs/planning/wireframes/index-v2.html",
    "component_map": "docs/planning/wireframes/COMPONENT-API-MAP-V2.md",
    "legacy_fixture_matrix": "tests/fixtures/mvp/public-synthetic-mvp-v2-acceptance.json"
  },
  "shared_schemas": {
    "surface_manifest": "docs/contracts/v2-mvp/v2-surface-manifest.v1.schema.json",
    "common": "docs/contracts/v2-mvp/v2-common-envelope.v1.schema.json",
    "claim_projection": "docs/contracts/v2-mvp/v2-claim-projection.v1.schema.json",
    "approval_validity": "docs/contracts/v2-mvp/v2-approval-validity.v1.schema.json",
    "agent_run_evidence": "docs/contracts/v2-mvp/v2-agent-run-evidence.v1.schema.json"
  },
  "truth_boundary": {
    "public_synthetic": {
      "durable": false,
      "resettable": true,
      "protected_content_allowed": false,
      "provider_requests_allowed": false,
      "external_actions_allowed": false,
      "acceptance_scope": "browser_and_contract_demonstration_only"
    },
    "durable": {
      "durable": true,
      "resettable": false,
      "required_backing": ["postgres", "capauth", "policy", "append_only_audit", "outbox", "provenance"],
      "acceptance_scope": "separately_composed_qualified_and_reviewed"
    }
  },
  "claim_identity": {
    "canonical_entity": "Claim",
    "canonical_id_field": "Claim.id",
    "canonical_lifecycle_owner": "Claim.status",
    "ledger_role": "one_to_one_append_only_evidence_review_projection",
    "ledger_identity_rule": "LedgerClaim.claim_id equals Claim.id",
    "required_invariants": ["same_tenant", "same_matter", "same_claim_id", "projected_claim_version_pinned", "no_orphan_ledger", "no_competing_lifecycle", "no_silent_statement_reconciliation"]
  },
  "approval_validity": {
    "schema_ref": "docs/contracts/v2-mvp/v2-approval-validity.v1.schema.json",
    "operative_all_required": ["status_approved", "tenant_match", "matter_match", "work_product_match", "version_id_match", "version_number_match", "content_sha256_match", "reviewer_attributed", "decision_time_recorded", "rationale_recorded", "validation_passed", "policy_revision_pinned", "capability_decision_allowed", "not_revoked", "not_superseded"]
  },
  "mutation_invariants": ["authenticated_principal", "server_derived_scope", "capability_allowed", "purpose_allowed", "policy_allowed", "idempotency_key_required", "request_sha256_bound", "optimistic_version_checked", "state_audit_outbox_atomic", "provenance_appended", "no_model_mutation_authority"],
  "operation_envelope_contract": {
    "request_context_required": ["authenticated_principal_id", "tenant_id", "matter_id", "resource_id", "capability", "purpose", "policy_decision_id", "correlation_id"],
    "mutation_request_additional_required": ["idempotency_key", "request_sha256", "expected_resource_version"],
    "response_context_required": ["tenant_id", "matter_id", "resource_id", "correlation_id", "schema_revision", "projection_revision", "provenance"],
    "mutation_response_additional_required": ["idempotency_key", "request_sha256", "resource_version", "audit_id", "outbox_id"],
    "scope_rule": "The server derives Tenant Matter and resource scope from authenticated authorization context and rejects a conflicting body header query or path binding.",
    "atomicity_rule": "A durable mutation commits state immutable audit provenance idempotency result and outbox record atomically or commits none.",
    "model_authority_rule": "A model may populate a typed proposal response only and never receives canonical mutation Approval or dispatch authority."
  },
  "closed_error_codes": ["authentication_required", "access_denied", "resource_unavailable", "validation_failed", "precondition_failed", "idempotency_conflict", "version_conflict", "policy_unavailable", "dependency_unavailable", "rate_limited", "internal_error"],
  "consumer_contract": {
    "react_sections": "apps/web/src/pages/MatterCockpit.tsx:v2CockpitSections",
    "fixture_loader": "tests/support/mvp_v2_cockpit.py:EXPECTED_SECTIONS",
    "contract_tests": "tests/contracts/test_v2_mvp_contract_freeze.py",
    "browser_qualifier_requirement": "Browser qualifiers must load canonical section_id values from this manifest and must not define an independent ordered tuple.",
    "openapi_requirement": "Current bindings must exist in generated OpenAPI. Durable target operations must be added by their owning lane and registered only by the backend integration owner."
  },
  "current_openapi_bindings": [
    {"operation_id": "get_workspace", "fastapi_operation_id": "workspace_matters_workspace"},
    {"operation_id": "get_claim_ledger", "fastapi_operation_id": "claims_ledger"},
    {"operation_id": "search_corpus", "fastapi_operation_id": "corpus_search"},
    {"operation_id": "get_corpus_span", "fastapi_operation_id": "corpus_span"}
  ],
  "lanes": [
    {"lane_id": "joined-analysis", "card_id": "929c6ada", "owns": ["joined_analysis_router", "joined_analysis_service", "joined_analysis_projection", "joined_analysis_fixture_fragment"], "publishes": ["MatterAnalysisRead", "RecommendationRead"], "must_not_edit": ["services/api/src/sklegal_api/app.py", "apps/web/src/pages/MatterCockpit.tsx", "apps/web/src/api/client.ts", "migrations/manifest.json"]},
    {"lane_id": "agent-runs", "card_id": "85967293", "owns": ["agent_run_router", "agent_run_service", "agent_run_persistence", "agent_run_fixture_fragment"], "publishes": ["AgentRunRead", "AgentRunCommand", "ChallengeCommand", "ModelEvidenceRead"], "must_not_edit": ["services/api/src/sklegal_api/app.py", "apps/web/src/pages/MatterCockpit.tsx", "apps/web/src/api/client.ts", "migrations/manifest.json"]},
    {"lane_id": "artifact-intake", "card_id": "6894d326", "owns": ["artifact_intake_router", "artifact_intake_service", "artifact_lineage_persistence", "artifact_fixture_fragment"], "publishes": ["ArtifactIntakeCommand", "ArtifactRead", "ArtifactLineageRead"], "must_not_edit": ["services/api/src/sklegal_api/app.py", "apps/web/src/pages/MatterCockpit.tsx", "apps/web/src/api/client.ts", "migrations/manifest.json"]},
    {"lane_id": "work-products", "card_id": "0d1d81ce", "owns": ["work_product_router", "work_product_service", "work_product_persistence", "work_product_fixture_fragment"], "publishes": ["WorkProductRead", "WorkProductVersionCommand", "ValidationRead", "ApprovalDecisionCommand"], "must_not_edit": ["services/api/src/sklegal_api/app.py", "apps/web/src/pages/MatterCockpit.tsx", "apps/web/src/api/client.ts", "migrations/manifest.json"]},
    {"lane_id": "tasks-deadlines", "card_id": "519832c7", "owns": ["task_deadline_router", "task_deadline_service", "task_deadline_persistence", "task_deadline_fixture_fragment"], "publishes": ["TaskRead", "TaskCommand", "DeadlineRead", "SimulationHandoffRead"], "must_not_edit": ["services/api/src/sklegal_api/app.py", "apps/web/src/pages/MatterCockpit.tsx", "apps/web/src/api/client.ts", "migrations/manifest.json"]},
    {"lane_id": "activity", "card_id": "ec0763b9", "owns": ["activity_router", "activity_projection", "activity_export_service", "activity_fixture_fragment"], "publishes": ["MatterActivityRead", "ActivityExportCommand"], "must_not_edit": ["services/api/src/sklegal_api/app.py", "apps/web/src/pages/MatterCockpit.tsx", "apps/web/src/api/client.ts", "migrations/manifest.json"]},
    {"lane_id": "corpus", "card_id": "e0ad0f06", "owns": ["durable_corpus_adapter", "corpus_projection", "corpus_fixture_fragment"], "publishes": ["CorpusSearchRead", "CorpusSpanRead", "RetrievalTraceRead"], "must_not_edit": ["services/api/src/sklegal_api/app.py", "apps/web/src/pages/MatterCockpit.tsx", "apps/web/src/api/client.ts", "migrations/manifest.json"]}
  ],
  "surfaces": [
    {"order": 1, "section_id": "decision", "legacy_fixture_section_id": "cover", "label": "Decision first", "lane_id": null, "current_truth": "static_reviewed", "durable_target": "static_reviewed", "operation_refs": []},
    {"order": 2, "section_id": "ai-operating-model", "legacy_fixture_section_id": "operating-model", "label": "AI operating model", "lane_id": "agent-runs", "current_truth": "static_reviewed", "durable_target": "durable_target", "operation_refs": ["create_analysis_run", "get_agent_run"]},
    {"order": 3, "section_id": "corpus-map", "legacy_fixture_section_id": "corpus-map", "label": "Corpus and verification map", "lane_id": "corpus", "current_truth": "static_reviewed", "durable_target": "durable_target", "operation_refs": ["search_corpus", "get_corpus_span"]},
    {"order": 4, "section_id": "ai-cockpit", "legacy_fixture_section_id": "cockpit", "label": "Matter cockpit", "lane_id": "joined-analysis", "current_truth": "public_synthetic_read", "durable_target": "durable_target", "operation_refs": ["get_workspace", "get_joined_analysis", "create_analysis_run"]},
    {"order": 5, "section_id": "ai-intake", "legacy_fixture_section_id": "intake", "label": "AI intake", "lane_id": "agent-runs", "current_truth": "safely_unavailable", "durable_target": "durable_target", "operation_refs": ["create_analysis_run"]},
    {"order": 6, "section_id": "artifact-intake", "legacy_fixture_section_id": "artifacts", "label": "Matter artifact intake", "lane_id": "artifact-intake", "current_truth": "public_synthetic_read", "durable_target": "durable_target", "operation_refs": ["get_artifact", "create_artifact_intake"]},
    {"order": 7, "section_id": "element-matrix", "legacy_fixture_section_id": "elements", "label": "Essential Elements matrix", "lane_id": "joined-analysis", "current_truth": "public_synthetic_read", "durable_target": "durable_target", "operation_refs": ["get_claim_ledger", "get_joined_analysis"]},